67834006,T-54710,Structure of deciduous mandibular right central incisor tooth (body structure)
67937003,T-47100,Structure of axillary artery (body structure)
67941004,T-C4331,Structure of superior tracheobronchial lymph node (body structure)
67956008,C-22928,Neutral red stain (substance)
67966000,A-26440,"Enema tube, device (physical object)"
67977006,L-80883,Clumber spaniel (organism)
68053000,T-47700,Structure of anterior tibial artery (body structure)
68085002,T-54210,Structure of maxillary right third molar tooth (body structure)
68086001,L-80A33,Persian cat (organism)
68171009,T-C4710,Axillary lymph node structure (body structure)
68183006,A-12030,"Bone screw, device (physical object)"
68235000,F-24442,Nasal congestion (finding)
68237008,D4-33622,Partial anomalous pulmonary venous connection (disorder)
68263003,C-22804,Janus green B stain (substance)
68276009,A-27500,"Bottle, device (physical object)"
68300000,T-32210,Structure of right auricular appendage (body structure)
68339009,T-C4144,Superficial intraparotid lymph node (body structure)
68367000,T-D9100,Thigh structure (body structure)
68453008,M-80103,"Carcinoma, no subtype (morphologic abnormality)"
68457009,P5-31500,Percutaneous transluminal balloon angioplasty (procedure)
68459007,C-22833,Crystal ponceau stain (substance)
68493006,G-A169,Gutter (qualifier value)
68496003,D5-41170,Polyp of colon (disorder)
68505006,T-D4140,Structure of left lower quadrant of abdomen (body structure)
68512002,L-80526,Boar power pig 141 (organism)
68523003,T-A2030,Cerebral white matter structure (body structure)
68552000,L-80200,Caprine species (organism)
68580003,C-130A3,^59^Iron (substance)
68598004,T-02142,Skin structure of ala nasi (body structure)
68630002,C-114A6,^125^Iodine (substance)
68698007,T-02104,Skin structure of forehead (body structure)
68703001,T-AA310,Choroidal structure (body structure)
68705008,T-49110,Structure of axillary vein (body structure)
68787002,T-43111,Structure of proximal portion of anterior descending branch of left coronary artery (body structure)
68796002,P5-D1000,Radioisotope study of musculoskeletal system (procedure)
68878000,T-C4442,Structure of lymph node of epiploic foramen (body structure)
68881005,T-C4513,Structure of superior rectal lymph node (body structure)
68915008,T-C4210,Structure of lateral cervical lymph node (body structure)
68967007,C-B1087,Iodocholesterol I^131^ (substance)
68978004,F-25040,Hyperventilation (finding)
69067004,L-80452,Shetland pony (organism)
69076006,C-B1180,Strontium chloride Sr^85^ (substance)
69089000,C-130A1,^52^Iron (substance)
69105007,T-45010,Carotid artery structure (body structure)
69133007,C-22862,Sudan IV stain (substance)
69158002,P2-35200,Intra-atrial pacing (procedure)
69245005,P1-05035,Intra-arterial infusion of thrombolytic agent (procedure)
69249004,L-80903,Weimaraner (organism)
69255009,T-C4630,Structure of hypogastric lymph node (body structure)
69327007,T-46200,Structure of internal thoracic artery (body structure)
69408002,D4-01046,Gorlin syndrome (disorder)
69421009,T-46423,Structure of right branch of hepatic artery (body structure)
69461005,L-80553,Chester white pig (organism)
69474004,L-80850,Samoyed dog (organism)
69529009,L-80724,Border terrier (organism)
69536005,T-D1100,Head structure (body structure)
69592005,L-80863,Standard schnauzer (organism)
69602006,L-80590,Kleen leen pig (organism)
69691007,T-C4750,Structure of pectoral axillary lymph node (body structure)
69695003,T-57000,Stomach structure (body structure)
69748006,T-B6000,Thyroid structure (body structure)
69783005,C-B0324,Meglumine iodipamide (substance)
69805005,A-28040,"Insulin pump, device (physical object)"
69833005,T-47410,Structure of right femoral artery (body structure)
69839009,C-B1096,Iodinated I^125^ povidone (substance)
69855002,L-80A06,American shorthair cat (organism)
69862006,L-80775,Smooth standard dachshund (organism)
69930009,T-65010,Pancreatic duct structure (body structure)
69954004,D3-87780,Thrombophlebitis of breast (disorder)
69986009,L-80700,Canine species (organism)
70007007,T-A5160,Substantia nigra structure (body structure)
70074004,T-26100,Right main bronchus structure (body structure)
70105001,T-A2880,Structure of optic radiation (body structure)
70106000,F-63600,Lipid (substance)
70142008,D4-31220,Atrial septal defect (disorder)
70150004,T-60650,Bile (substance)
70154008,C-B1099,Iodinated I^125^ sodium iodine (substance)
70215001,T-A2730,Structure of genu of corpus callosum (body structure)
70232002,G-7154,Frequent (qualifier value)
70238003,T-32640,Structure of inflow tract of left ventricle (body structure)
70253006,T-48814,Structure of left main branch of portal vein (body structure)
70258002,T-15750,Ankle joint structure (body structure)
70382005,T-45900,Structure of posterior cerebral artery (body structure)
70431006,L-80205,Alpine goat (organism)
70457009,L-80428,Icelandic horse (organism)
70520000,C-22828,Ponceau xylidine stain (substance)
70544003,C-146B1,^199^Gold (substance)
70559009,T-02632,Skin structure of anterior surface of forearm (body structure)
70594002,M-87303,Amelanotic melanoma (morphologic abnormality)
70653001,L-80A11,British shorthaired cat (organism)
70762009,T-02100,Skin structure of head (body structure)
70791007,T-47040,Structure of artery of lower extremity (body structure)
70822001,F-32070,"Cardiac ejection fraction, function (observable entity)"
70847004,T-F1300,Structure of amnion (body structure)
70887009,T-02652,Skin structure of palmar area of hand (body structure)
70925003,T-11170,Bone structure of maxilla (body structure)
70984001,M-32260,Serpentine aneurysm (morphologic abnormality)
70995007,D3-40300,Pulmonary hypertension (disorder)
71128006,C-15000,Molybdenum (substance)
71133005,T-62023,Structure of caudate lobe of liver (body structure)
71173004,M-01460,Compression (morphologic abnormality)
71175006,L-80736,Bullmastiff (organism)
71232009,M-90201,"Phyllodes tumor, borderline (morphologic abnormality)"
71252005,T-83200,Cervix uteri structure (body structure)
71271007,T-48411,Structure of coronary sinus ostium (body structure)
71341001,T-12710,Bone structure of femur (body structure)
71384000,A-17450,"Warmer, device (physical object)"
71388002,P0-00000,Procedure (procedure)
71400007,T-1A120,Mesothelium structure (body structure)
71425003,C-127A1,^61^Copper (substance)
71553001,T-75110,Prostatic urethra structure (body structure)
71585003,T-48160,Structure of external jugular vein (body structure)
71616004,T-13001,Skeletal and/or smooth muscle structure (body structure)
71633006,C-155A1,^22^Sodium (substance)
71636003,C-B1082,Fibrinogen I^123^ (substance)
71647005,C-105A2,^14^Carbon (substance)
71651007,P5-40010,Mammography (procedure)
71758008,T-49640,Structure of peroneal vein (body structure)
71759000,C-81560,Nitroglycerin (product)
71836000,T-23000,Nasopharyngeal structure (body structure)
71854001,T-59300,Colon structure (body structure)
71908006,D3-31720,Ventricular fibrillation (disorder)
71923001,L-80607,Italian landrace pig (organism)
71957009,C-22922,Phloxin B stain (substance)
71966008,T-03000,Subcutaneous tissue structure (body structure)
72001000,T-12700,Bone structure of lower limb (body structure)
72005009,T-02432,Skin structure of areola (body structure)
72015003,C-B1084,Iodinated I^125^ albumin (substance)
72021004,T-45210,Structure of superior thyroid artery (body structure)
72092001,D3-81100,Arteriosclerotic vascular disease (disorder)
72107004,T-48340,Structure of azygous vein (body structure)
72159005,C-B1023,Cyanocobalamin Co^60^ (substance)
72164009,F-61A90,Inositol (substance)
72166006,M-52300,Fibroelastosis (morphologic abnormality)
72184008,T-11303,Structure of neck of rib (body structure)
72329005,L-80322,Finnish landrace sheep (organism)
72371006,C-22879,Fast violet B salt stain (substance)
72394007,L-80412,American tunis horse (organism)
72410000,T-D3300,Mediastinal structure (body structure)
72454006,C-163A8,^99m^Technetium (substance)
72481006,T-28300,Structure of middle lobe of right lung (body structure)
72495009,M-84803,Mucinous adenocarcinoma (morphologic abnormality)
72506001,A-11206,"Implantable defibrillator, device (physical object)"
72542009,T-32632,Structure of myocardium of diaphragmatic region (body structure)
72572003,C-22826,Diamond black stain (substance)
72573008,T-13620,Infraspinatus muscle structure (body structure)
72592005,T-59442,Structure of left colic flexure (body structure)
72607000,G-D108,Intrathecal route (qualifier value)
72641008,P1-C0B00,Administration of sedative (procedure)
72648002,L-80348,Suffolk sheep (organism)
72674008,T-280D0,Bronchopulmonary segment structure (body structure)
72696002,T-D9200,Knee region structure (body structure)
72717003,C-14800,Magnesium (substance)
72876007,T-54310,Structure of maxillary left canine tooth (body structure)
72939005,T-02613,Skin structure of posterior surface of upper arm (body structure)
73002000,P2-36102,Measurement of systemic arterial pressure (regime/therapy)
73005003,L-80578,FHC elite pig 8 (organism)
73049001,L-80A44,Scottish fold cat (organism)
73050001,T-32634,Structure of myocardium of anterolateral region (body structure)
73056007,T-04020,Right breast structure (body structure)
73058008,T-02520,Skin of structure of labium pudendum (body structure)
73065000,C-B1041,Gallium^67^ citrate (substance)
73117003,T-11150,Sphenoid bone structure (body structure)
73166001,T-42580,Structure of aortic bifurcation (body structure)
73191001,L-80331,American merino sheep (organism)
73212002,C-B0318,Iodipamide (product)
73219006,M-88610,Angiolipoma (morphologic abnormality)
73251007,C-22A02,Auramine G stain (substance)
73271003,L-80A19,Domestic leopard cat (organism)
73318001,L-80820,Pointer (organism)
73319009,L-80760,Coonhound (organism)
73400003,T-11513,Structure of transverse process of vertebra (body structure)
73544002,P1-32000,Operation on heart valve (procedure)
73580002,T-48430,Structure of middle cardiac vein (body structure)
73634005,T-46710,Common iliac artery structure (body structure)
73648005,L-80661,Wessex saddleback pig (organism)
73678001,S-10151,Natural sister (person)
73685002,C-B1231,Thallous chloride Tl^201^ (substance)
73774007,D3-28102,Subacute bacterial endocarditis (disorder)
73829009,T-32200,Right atrial structure (body structure)
73892005,C-22971,Carmine stain (substance)
73897004,T-02120,Skin structure of face (body structure)
73930003,T-14150,Structure of levator costae muscle (body structure)
73931004,T-48813,Structure of right main branch of portal vein (body structure)
73937000,T-54680,Structure of deciduous maxillary left canine tooth (body structure)
73949004,C-67770,Atropine (product)
73958006,T-02814,Skin structure of medial surface of thigh (body structure)
74021003,D3-33200,Bifascicular block (disorder)
74031005,T-32832,Left bundle branch structure (body structure)
74135004,T-15009,Meniscus structure of joint (body structure)
74156002,T-47660,Structure of medial plantar artery (body structure)
74160004,T-02424,Skin structure of chest (body structure)
74173000,L-80847,Rhodesian ridgeback dog (organism)
74203007,T-C4260,Structure of prelaryngeal lymph node (body structure)
74262004,T-51004,Oral cavity structure (body structure)
74280008,M-83153,Glycogen-rich carcinoma (morphologic abnormality)
74308000,T-93010,Structure of right seminal vesicle (body structure)
74344005,T-54370,Structure of mandibular left third molar tooth (body structure)
74364000,M-80413,Small cell carcinoma (morphologic abnormality)
74386004,T-11149,Nasal bone structure (body structure)
74517004,L-80640,Montana pig (organism)
74536009,L-80716,Belgian groenendael dog (organism)
74551000,M-02560,Circumference (qualifier value)
74554008,C-B0341,Iodophthalein (substance)
74568001,L-80656,Red wattle pig (organism)
74615001,D3-31121,Tachycardia-bradycardia (disorder)
74626007,C-50013,Drug diluent (product)
74670003,T-15460,Wrist joint structure (body structure)
74745008,L-80207,Rock alpine goat (organism)
74872008,T-11110,Frontal bone structure (body structure)
74899005,L-80520,Boar power pig (organism)
74921000,L-80560,Dekalb hybrid pig line (organism)
74937006,M-52102,Complicated atheromatous plaque (morphologic abnormality)
74947009,C-10080,Gaseous substance (substance)
74968005,T-A1630,Structure of cavum septi pellucidi (body structure)
74970001,L-80527,Boar power pig 161 (organism)
75040000,T-C4143,Deep intraparotid lymph node (body structure)
75042008,T-A1220,Arachnoid structure (body structure)
75053002,D3-81660,Acute febrile mucocutaneous lymph node syndrome (disorder)
75093004,T-02480,Skin structure of abdomen (body structure)
75118006,PA-00600,Feeding patient (regime/therapy)
75129005,T-1242B,Bone structure of distal radius (body structure)
75245000,T-26500,Left main bronchus structure (body structure)
75294000,G-A600,Descending (qualifier value)
75319007,T-11219,Structure of clavicular notch of sternum (body structure)
75367002,F-31000,Blood pressure (observable entity)
75397005,T-42340,Structure of preductal region of aortic arch (body structure)
75494002,L-807C6,Irish terrier (organism)
75531005,T-47020,Structure of artery of upper extremity (body structure)
75540009,G-A373,High (qualifier value)
75573002,T-C5100,Tonsillar structure (palatine) (body structure)
75696008,C-166A2,^45^Titanium (substance)
75709004,L-80650,Pic pig (organism)
75753009,M-35000,Blood clot (morphologic abnormality)
75772009,T-12800,Bone structure of navicular (body structure)
75777003,F-CB250,Cytokine (substance)
75902001,T-43124,Structure of atrioventricular branch of circumflex branch of left coronary artery (body structure)
75911001,L-80751,Bearded collie (organism)
75956008,C-22967,Hematein stain (substance)
75958009,G-C020,Bounded by (attribute)
75959001,C-781E0,Tamoxifen (product)
75976002,G-4041,Mild risk of (contextual qualifier) (qualifier value)
76001002,C-22916,Pyronine B stain (substance)
76015000,T-46420,Hepatic artery (body structure)
76025005,P1-31876,Correction of ventricular septal defect (procedure)
76048000,C-22929,Azocarmine G (GX) stain (substance)
76072005,T-02306,Skin structure of supraclavicular region of neck (body structure)
76117006,T-45430,Structure of central retinal artery (body structure)
76155001,C-B0328,Iopanoic acid (product)
76171001,F-20240,Air trapping (finding)
76197007,M-72000,Hyperplasia (morphologic abnormality)
76261009,T-02420,Skin structure of axilla (body structure)
76267008,D3-29050,Pulmonary valve disorder (disorder)
76290003,T-C4633,Structure of superior gluteal lymph node (body structure)
76302002,L-80456,Spanish mustang horse (organism)
76351004,L-80914,Whippet dog (organism)
76364003,L-80521,Boar power pig 27 (organism)
76365002,T-04004,Structure of upper outer quadrant of breast (body structure)
76388001,F-38277,ST segment elevation (finding)
76439002,C-22859,Fat red 7B stain (substance)
76467006,L-80454,Quarter horse (organism)
76497003,L-80132,Gelbveih cattle breed (organism)
76505004,T-D8810,Thumb structure (body structure)
76554006,L-80717,Belgian laeken dog (organism)
76604009,L-80153,Nellore cattle breed (organism)
76605005,C-22866,Biebrich scarlet stain (substance)
76611008,P1-30352,Atherectomy by laser (procedure)
76633005,C-22875,Fast red TR salt stain (substance)
76649007,D7-90382,Sebaceous cyst of skin of breast (disorder)
76659008,T-C4475,Structure of pancreaticoduodenal lymph node (body structure)
76704003,T-C4842,Superior lateral inguinal lymph node (body structure)
76710003,T-AA650,Structure of external limiting membrane of retina (body structure)
76723005,T-02525,Skin structure of prepuce of clitoris (body structure)
76724004,L-807C3,Harrier dog (organism)
76752008,T-04000,Breast structure (body structure)
76784001,T-82000,Vaginal structure (body structure)
76838003,T-C4220,Structure of supraclavicular lymph node (body structure)
76848001,T-39000,Pericardial structure (body structure)
76862008,T-43105,Structure of ostium of left coronary artery (body structure)
76878005,T-C4456,Structure of lymph node of greater curvature of stomach (body structure)
76909002,M-92603,Ewing's sarcoma (morphologic abnormality)
76925007,C-22903,Alkali blue 5B (4B) stain (substance)
76927004,P5-D7000,Radioisotope study of genitourinary system (procedure)
76994004,L-80808,Norwegian elkhound (organism)
77004003,C-111A1,^18^Fluorine (substance)
77012006,T-F1320,Amniotic fluid (substance)
77073008,C-22941,Nile blue stain (substance)
77130001,T-54430,Structure of mandibular left lateral incisor tooth (body structure)
77176002,S-32000,Smoker (finding)
77213006,L-80706,Afghan hound (organism)
77236002,L-80611,Large white pig (organism)
77296004,D7-90452,Infarction of breast (disorder)
77313009,C-B1223,Technetium Tc^99m^ exametazime (substance)
77343006,P5-009A0,Angiography (procedure)
77386006,F-84000,Patient currently pregnant (finding)
77444004,A-12024,"Bone pin, device (physical object)"
77477000,P5-08000,Computerized axial tomography (procedure)
77568009,T-D2100,"Back structure, excluding neck (body structure)"
77583004,T-35410,Structure of anulus fibrosus of aorta (body structure)
77621008,T-D1620,Structure of supraclavicular region of neck (body structure)
77671006,F-B1810,Antidiuretic hormone (substance)
77720000,A-12062,"Clip, device (physical object)"
77778009,T-C4474,Structure of pancreatic lymph node (body structure)
77831004,T-04002,Structure of upper inner quadrant of breast (body structure)
78014005,T-70060,Urine (substance)
78023008,C-158A5,^87m^Strontium (substance)
78067005,T-F1100,Placental structure (body structure)
78076003,T-AA700,Structure of lens of eye (body structure)
78197004,M-85012,"Comedocarcinoma, noninfiltrating (morphologic abnormality)"
78214003,L-807D6,Lakeland terrier (organism)
78246003,L-80804,Mexican hairless dog (organism)
78267003,D9-30400,Cocaine abuse (disorder)
78277001,T-A2500,Temporal lobe structure (body structure)
78421000,G-D103,Intramuscular route (qualifier value)
78480002,T-44200,Structure of right pulmonary artery (body structure)
78481003,C-B1108,Iofetamine I^123^ hydrochloride (substance)
78541007,L-80171,Milking Shorthorn cattle breed (organism)
78570003,C-B1067,Indium^111^ transferrin (substance)
78678003,L-8B100,Sus scrofa (organism)
78686003,C-B1017,Copper^64^ acetate (substance)
78869007,C-22955,Nuclear fast red stain (substance)
78904004,T-D3050,Chest wall structure (body structure)
78961009,T-C3000,Splenic structure (body structure)
78972004,T-11515,Structure of pedicle of vertebra (body structure)
78994007,L-80602,British landrace pig (organism)
79058000,L-80100,Bovine species (organism)
79068005,A-30360,"Needle, device (physical object)"
79142001,T-44010,Suprapulmonic valve area structure (body structure)
79163004,T-B6200,Structure of left lobe of thyroid gland (body structure)
79197006,C-159A2,^82^Rubidium (substance)
79283007,T-02143,Skin structure of tip of nose (body structure)
79295007,L-80726,Boston terrier (organism)
79313003,T-02202,Skin structure of helix (body structure)
79361005,T-15200,Structure of fontanel of skull (body structure)
79458005,G-A599,Ascending (qualifier value)
79477007,C-131A1,^66^Gallium (substance)
79502000,T-02211,Skin structure of tragus (body structure)
79523006,C-113A2,^76^Bromine (substance)
79601000,T-12280,Bone structure of scapula (body structure)
79603002,L-80343,Romedale sheep (organism)
79610008,C-B1216,Technetium Tc^99m^ serum albumin (substance)
79619009,D3-29011,Mitral valve stenosis (disorder)
79652003,T-AA770,Internal structure of eyeball (body structure)
79654002,M-36300,Edema (morphologic abnormality)
79692001,F-32340,Right to left cardiovascular shunt (finding)
79741001,T-64500,Common bile duct structure (body structure)
79811009,A-18041,"Electric blanket, device (physical object)"
79814001,L-80655,Poland China pig (organism)
79926007,T-C4650,Structure of sacral lymph node (body structure)
79951008,T-02109,Skin of occipital region (body structure)
80049006,T-A2750,Structure of forceps major (body structure)
80084005,L-80612,Lucie pig (organism)
80131009,L-80600,Landrace pig (organism)
80140008,T-54480,Structure of mandibular right first premolar tooth (body structure)
80144004,T-12770,Bone structure of calcaneum (body structure)
80243003,T-AA810,Eyelid structure (body structure)
80248007,T-04030,Left breast structure (body structure)
80272002,T-45160,Structure of carotid bifurcation (body structure)
80274001,F-70210,Glomerular filtration rate (observable entity)
80305003,C-22856,Pontamine sky blue 6BX stain (substance)
80313002,F-37150,Palpitations (finding)
80434005,T-A2870,Structure of vertical occipital fasciculus (body structure)
80447000,T-A1800,Structure of cerebral aqueduct (body structure)
80576000,L-80892,Sussex spaniel (organism)
80581009,T-D4001,Upper abdomen structure (body structure)
80621003,T-A1900,Structure of choroid plexus (body structure)
80622005,T-A8130,Abducens nerve structure (body structure)
80647007,T-54260,Structure of maxillary right canine tooth (body structure)
80751004,C-172A8,^133^Xenon (substance)
80769008,T-C4860,Structure of tibial lymph node (body structure)
80777007,L-80413,Andalusian horse (organism)
80835003,L-80170,Shorthorn cattle breed (organism)
80865008,P5-40030,Specimen mammography (procedure)
80867000,T-C4631,Structure of gluteal lymph node (body structure)
80891009,T-32000,Heart structure (body structure)
80917008,C-00224,Toxin (substance)
80919006,A-61000,Jewelry (physical object)
80943009,F-01500,Risk factor (observable entity)
80979001,L-80657,San Pierre pig (organism)
81016008,T-AA630,Optic disc structure (body structure)
81040000,T-44000,Pulmonary artery structure (body structure)
81105003,T-C4200,Cervical lymph node structure (body structure)
81128002,T-42200,Structure of sinus of Valsalva (body structure)
81132008,T-C4290,Structure of scalene lymph node (body structure)
81267004,L-80154,Normande cattle breed (organism)
81274009,M-73310,Apocrine metaplasia (morphologic abnormality)
81323004,F-00001,Normal general body function (finding)
81397005,C-22A01,Auramine O stain (substance)
81502006,T-55300,Hypopharyngeal structure (body structure)
81529001,L-80723,Bloodhound (organism)
81607005,L-807D2,Keeshond (organism)
81621007,C-B1066,Indium^111^ red cell label (substance)
81654009,G-A138,Coronal (qualifier value)
81669005,M-95401,Neurofibromatosis (morphologic abnormality)
81727001,T-13300,Skeletal muscle structure of neck (body structure)
81745001,T-AA000,Structure of eye proper (body structure)
81761004,C-B1203,Technetium Tc^99m^ microaggregated albumin (substance)
81827009,M-02550,Diameter (qualifier value)
81839001,C-A6500,Anticoagulant (product)
81866001,L-80A21,Maine coon cat (organism)
81911001,C-F3310,Chewing tobacco (substance)
81992007,T-02545,Skin structure of scrotum (body structure)
82078001,PA-20110,Collection of blood specimen for laboratory (procedure)
82206008,L-80885,Black cocker spaniel (organism)
82264009,C-677C0,Homatropine (product)
82280004,G-A545,Smooth (qualifier value)
82334004,G-A385,Indeterminate (qualifier value)
82365008,T-C4350,Structure of parasternal lymph node (body structure)
82440005,L-80327,Hampshire Down sheep (organism)
82449006,A-26836,"Peripheral intravenous catheter, device (physical object)"
82471001,T-32300,Left atrial structure (body structure)
82474009,T-12771,Calcaneal tubercle structure (body structure)
82561000,T-15690,Symphysis pubis structure (body structure)
82566005,C-F5000,Animal feed (substance)
82573000,C-80400,Lidocaine (product)
82628004,T-54460,Structure of mandibular right lateral incisor tooth (body structure)
82676003,L-88120,Wolf (organism)
82680008,T-D0310,Digit structure (body structure)
82682000,C-22895,Victoria blue 4R stain (substance)
82711006,M-85003,Infiltrating duct carcinoma (morphologic abnormality)
82799009,F-32100,Cardiac output (observable entity)
82849001,T-D4900,Retroperitoneal compartment structure (body structure)
82909008,L-80622,Middle white pig (organism)
83018002,T-47690,Plantar arterial arch structure (body structure)
83036002,F-61760,Lactate (substance)
83059008,A-26400,"Tube, device (physical object)"
83173002,L-80160,Scottish Highland cattle breed (organism)
83216009,L-80733,Staffordshire bull terrier (organism)
83236005,L-80895,Saint Bernard dog (organism)
83251001,T-A2200,Frontal lobe structure (body structure)
83323007,F-12100,"Bone formation, function (observable entity)"
83330001,D4-32012,Patent ductus arteriosus (disorder)
83380007,T-C4458,Structure of gastro-omental lymph node (body structure)
83419000,T-49410,Femoral vein structure (body structure)
83420006,S-10181,Natural daughter (person)
83422003,P1-30022,Diagnostic procedure on blood vessel (procedure)
83423008,C-B0342,Sodium diprotrizoate (substance)
83504004,L-80793,Finnish spitz dog (organism)
83555006,T-C6010,Structure of lymphatic vessel (body structure)
83578000,G-B102,Surgical (qualifier value)
83598005,C-17200,Xenon (substance)
83600004,C-22920,Spirit soluble eosin stain (substance)
83670000,T-D4425,Peritoneal cavity structure (body structure)
83799000,D4-31040,Corrected transposition of great vessels (disorder)
83881004,C-12013,Aluminum oxide (substance)
83996001,L-80119,Criollo cattle breed (organism)
84081007,L-80537,Boar power pig 747 (organism)
84114007,D3-16000,Heart failure (disorder)
84217005,C-22845,Titan yellow stain (substance)
84219008,T-C4610,Structure of iliac lymph node (body structure)
84229001,F-01360,Fatigue (finding)
84232003,L-80592,Kleen leen red pig (organism)
84301002,T-AB200,External auditory canal structure (body structure)
84315000,L-80532,Boar power pig 474 (organism)
84360004,M-02120,Ovoid shape (qualifier value)
84365009,T-02153,Skin structure of philtrum (body structure)
84367001,L-80871,English setter (organism)
84386009,C-6A16E,Tribromoethanol (substance)
84421000,T-487A0,Structure of abdominal vein (body structure)
84507004,T-02821,Skin structure of popliteal fossa (body structure)
84514002,L-80708,Akita dog (organism)
