288546009,T-D07CB,Lower alveolar ridge structure (body structure)
288563008,R-42517,After values (qualifier value)
289894009,F-840B3,Menstrual bleeding present (finding)
289925000,F-61779,Waste material (substance)
290006006,F-61790,Photon (substance)
290069002,F-8A074,Discoloration of skin of breast (finding)
290084006,F-8A084,Breast normal (finding)
290113009,D7-90565,Bloody nipple discharge (disorder)
290119008,F-8A09C,Nipple problem (finding)
292094009,DF-10780,Radiopharmaceutical adverse reaction (disorder)
292095005,DF-10781,Contrast media adverse reaction (disorder)
293637006,DF-10F41,Allergy to contrast media (disorder)
293638001,DF-10F42,Allergy to X-ray contrast media (disorder)
297120004,A-00BA2,Anesthetic face mask (physical object)
297171002,T-D00F7,Cervicothoracic region of spine structure (body structure)
297172009,T-D00F8,Thoracolumbar region of spine structure (body structure)
297173004,T-D00F9,Lumbosacral region of spine structure (body structure)
297174005,T-D00FA,Sacrococcygeal region of spine structure (body structure)
297968009,F-40031,Bleeding skin (finding)
298336006,F-100EC,No motor response to command (finding)
299716001,T-41068,Iliac and/or femoral artery structures (body structure)
299993000,T-C4417,Structure of mesenteric artery lymph node (body structure)
300571009,F-03FC9,Finding of gestational sac (finding)
300577008,F-03FCD,Finding of lesion (finding)
300841009,R-428E7,Poorly defined (qualifier value)
300842002,G-C2FE,Shape (attribute)
300995000,D3-13025,Exercise-induced angina (disorder)
301121007,F-30172,Myocardial perfusion normal (finding)
301939004,F-0123A,Constricted pupil (finding)
302343007,P1-48502,Insertion of prosthesis for breast (procedure)
302396003,P1-40C19,Cryotherapy to skin lesion (procedure)
302924003,D7-9002A,Breast hematoma (disorder)
303110006,R-422A4,Postprocedural period (qualifier value)
303111005,R-422A5,During menopause (qualifier value)
303270005,T-50007,Liver and/or biliary structure (body structure)
303337002,T-C5001,Tonsil and adenoid structure (body structure)
303402001,T-71019,Vascular structure of kidney (body structure)
303623000,T-C4867,Structure of posterior tibial lymph node (body structure)
303653007,P5-08067,Computed tomography of head (procedure)
303680000,P5-0807F,Computed tomography of cardiovascular system (procedure)
303713004,T-C4866,Structure of anterior tibial lymph node (body structure)
303827001,P5-00A0D,Trunk angiography (procedure)
303960004,C-50434,Thrombolytic (product)
304059001,R-427E6,Endocardial (qualifier value)
304121006,A-04459,Femoral head prosthesis (physical object)
304283002,R-42806,Half-life of radiopharmaceutical (qualifier value)
304292004,J-00556,Surgeon (occupation)
304367000,R-42808,Uncemented component fixation (qualifier value)
304915008,G-E002,Duke's coronary artery disease score (assessment scale)
305437000,T-3500E,Cardiac valve annulus (body structure)
306783000,T-1273F,Tibial plateau structure (body structure)
307047009,F-00BB8,Core body temperature measured in rectum (observable entity)
307152002,R-40FB8,Temporal periods relating to procedure (qualifier value)
307153007,R-40FB9,Before procedure (qualifier value)
307154001,R-40FBA,During procedure (qualifier value)
307280005,P0-004BA,Implantation of cardiac pacemaker (procedure)
307429007,R-410C3,After menopause (qualifier value)
307486002,R-4112F,Single event (qualifier value)
307502000,D5-F0519,Squamous cell carcinoma of mouth (disorder)
308064009,G-0102,History of cerebrovascular disease (situation)
308546005,D3-80016,Dissection of aorta (disorder)
308689002,F-20172,Coin lesion of lung (finding)
308696000,P5-39106,Coarctation angioplasty (procedure)
309050000,G-80A5,Body substance sample (specimen)
309051001,G-80A6,Body fluid sample (specimen)
309058007,G-832D,Breast tru-cut biopsy sample (specimen)
309059004,G-8339,Frozen section breast sample (specimen)
309312004,T-D021B,Cartilage tissue (body structure)
309343006,J-004E8,Physician (occupation)
309390008,J-0050A,Hospital consultant (occupation)
309546004,G-833D,Lumpectomy breast sample (specimen)
309547008,G-833F,Segmentectomy breast sample (specimen)
309548003,G-8346,Breast duct sample (specimen)
309587003,F-8A057,Calcification of breast (finding)
309602000,R-41FFC,Temporal periods relating to feeding and eating (qualifier value)
309606002,R-41FFF,Before menopause (qualifier value)
309649001,R-2073F,On examination - lens (finding)
309825002,R-42018,Spatial and relational concepts (qualifier value)
309901009,R-3023A,Anesthetic department (environment)
309902002,R-3023B,Clinical oncology department (environment)
309903007,R-3023C,Radiotherapy department (environment)
309904001,R-3023D,Intensive care unit (environment)
309907008,R-30240,Cardiac intensive care unit (environment)
309910001,R-30243,Pediatric intensive care unit (environment)
309913004,R-30246,Clinical allergy department (environment)
309914005,R-30247,Audiology department (environment)
309915006,R-30248,Cardiology department (environment)
309918008,R-3024B,Respiratory medicine department (environment)
309923008,R-30250,Dermatology department (environment)
309925001,R-30252,Endocrinology department (environment)
309927009,R-30254,General medical department (environment)
309933000,R-3025A,Care of the elderly department (environment)
309934006,R-3025B,Infectious diseases department (environment)
309935007,R-3025C,Medical ophthalmology department (environment)
309936008,R-3025D,Nephrology department (environment)
309937004,R-3025E,Neurology department (environment)
309938009,R-3025F,Nuclear medicine department (environment)
309939001,R-30260,Palliative care department (environment)
309940004,R-30261,Rehabilitation department (environment)
309941000,R-30262,Rheumatology department (environment)
309942007,R-30263,Obstetrics and gynecology department (environment)
309943002,R-30264,Gynecology department (environment)
309944008,R-30265,Obstetrics department (environment)
309948006,R-30269,Pediatric oncology department (environment)
309949003,R-3026A,Pain management department (environment)
309950003,R-3026B,Pathology department (environment)
309954007,R-3026F,Hematology department (environment)
309956009,R-30270,Medical microbiology department (environment)
309958005,R-30275,Psychiatry department (environment)
309959002,R-30276,Child and adolescent psychiatry department (environment)
309964003,R-3027B,Radiology department (environment)
309966001,R-3027D,Stroke unit (environment)
309967005,R-3027E,Surgical department (environment)
309968000,R-3027F,Breast surgery department (environment)
309969008,R-30280,Cardiothoracic surgery department (environment)
309970009,R-30281,Thoracic surgery department (environment)
309971008,R-30282,Cardiac surgery department (environment)
309972001,R-30283,Dental surgery department (environment)
309974000,R-30285,Oral surgery department (environment)
309978002,R-30289,"Ear, nose and throat department (environment)"
309979005,R-3028A,Endocrine surgery department (environment)
309980008,R-3028B,Gastrointestinal surgery department (environment)
309983005,R-3028E,Colorectal surgery department (environment)
309984004,R-3028F,General surgical department (environment)
309985003,R-30290,Hand surgery department (environment)
309989009,R-30294,Orthopedic department (environment)
309991001,R-30296,Pediatric surgical department (environment)
309992008,R-30297,Plastic surgery department (environment)
309993003,R-30298,Surgical transplant department (environment)
309994009,R-30299,Trauma surgery department (environment)
309995005,R-3029A,Urology department (environment)
309996006,R-3029B,Vascular surgery department (environment)
310030000,R-421D4,Endoscopy service (qualifier value)
310076001,R-421EB,Clinical biochemistry service (qualifier value)
310101009,R-42203,Speech and language therapy service (qualifier value)
310105000,R-42207,Optometry service (qualifier value)
310123008,R-42219,Psychology service (qualifier value)
310127009,R-4221D,Magnetic resonance imaging service (qualifier value)
310128004,R-4221E,Computerized tomography service (qualifier value)
310158005,R-4223B,Hepatobiliary surgical service (qualifier value)
310159002,R-4223C,Neurosurgical service (qualifier value)
310169008,R-42246,Ultrasonography service (qualifier value)
310200001,R-4225D,Cytology service (qualifier value)
310464005,R-302A2,Physiotherapy department (environment)
310651003,T-D078C,Bone structure of proximal femur (body structure)
310652005,T-D078D,Bone structure of distal femur (body structure)
310787001,T-D03C3,Structure of lung and/or mediastinum (body structure)
310805002,C-2282E,Sudan black stain (substance)
311731000,F-616D8,Paraffin wax (substance)
312004007,R-42E61,Retrograde direction (qualifier value)
312064005,C-50309,Hypoglycemic agent (product)
312288001,T-D000F,Vascular graft (morphologic abnormality)
312500006,T-C4003,Regional lymph node structure (body structure)
312501005,T-C4004,Structure of lymph node of head and neck (body structure)
312502003,T-D200A,Lymph node structure of trunk (body structure)
312503008,T-C4005,Lymph node structure of limb (body structure)
312522004,T-35008,"Common (non-mitral, non-tricuspid) atrioventricular valve structure (body structure)"
312535008,T-20101,Pharynx and/or larynx structures (body structure)
312779009,T-D006D,Bone structure of head and/or neck (body structure)
312965008,P0-0526F,Laser assisted in situ keratomileusis (procedure)
313376005,R-207AD,No family history: breast carcinoma (situation)
314116003,D3-13014,Post infarct angina (disorder)
314186008,D3-83602,Inflammatory abdominal aortic aneurysm (disorder)
314348007,R-20839,On examination - poor visual fixation (finding)
314439003,F-00E11,Maximum systolic blood pressure (observable entity)
314440001,F-00E14,Average systolic blood pressure (observable entity)
314451001,F-00E1F,Minimum diastolic blood pressure (observable entity)
314452008,F-00E21,Maximum diastolic blood pressure (observable entity)
314453003,F-00E22,Average diastolic blood pressure (observable entity)
314730000,T-C4414,Lymph node of stomach (body structure)
314736006,T-C463E,Female genital lymph node (body structure)
314796009,T-127A7,Malleolar structure of tibia (body structure)
314900004,C-2282D,Sudan stain (substance)
317665004,T-1153E,Structure of superior articular process of vertebra (body structure)
317766009,T-1153F,Structure of inferior articular process of vertebra (body structure)
320917000,C-6A102,Oxygen gas (product)
330888007,C-B0295,Rose bengal product (product)
333111009,R-F748A,Permethrin stain (substance)
337915000,L-85003,Homo sapiens (organism)
339648008,A-10DBC,Colostomy bag (physical object)
341036005,A-120DD,Colostomy set (physical object)
342706005,A-1009E,Ileostomy set (physical object)
344088002,A-105E3,Urostomy bag (physical object)
344575009,A-10703,Urostomy set (physical object)
344994008,P2-35002,Intraventricular pacing (procedure)
346322006,C-80609,Anion exchange resin (product)
346441008,C-8060A,Fish oils (product)
346553009,C-80477,Lidocaine+prilocaine (product)
347379006,C-70434,Lactated Ringer's solution (product)
349358000,C-B02C9,Radiopharmaceuticals (product)
350086004,C-B02CC,Fluorescein product (product)
353842007,C-B1130,Thallium-201 (product)
353903006,C-B0382,Iopromide (product)
353912008,C-B038B,Iothalamate (product)
353962003,C-B03BC,Iodixanol (product)
354064008,C-B02C5,Methylene blue product (product)
354088005,C-B03C3,Gadodiamide (product)
354094002,C-B03C9,Metrizoate (product)
360038009,P0-021D6,Gluing - action (qualifier value)
360066001,A-11FCD,Left ventricular assist device (physical object)
360129009,A-040CB,Cardiac pacemaker lead (physical object)
360156006,R-42453,Screening - procedure intent (qualifier value)
360271000,P0-021FD,Prophylaxis - procedure intent (qualifier value)
360465008,D3-2906A,Idiopathic hypertrophic subaortic stenosis (disorder)
360481003,D4-31303,Common atrioventricular canal (disorder)
360568007,T-D07EA,Corticospinal tract in brainstem (body structure)
360592004,T-48081,Systemic venous structure (body structure)
360955006,T-2300C,Region of nasopharynx (body structure)
360992006,T-C4601,Vesicular lymph node (body structure)
360993001,T-C4602,Lacunar lymph node (body structure)
361078006,T-AB959,Area of internal auditory canal (body structure)
361097006,T-40003,Entire blood vessel (body structure)
362072009,T-4940B,Saphenous vein structure (body structure)
362892003,T-D060D,Thyroid part (body structure)
362916000,T-D149C,Skin of eye region (body structure)
363354003,DF-0040E,Malignant tumor of cervix (disorder)
363406005,DF-0044A,Malignant tumor of colon (disorder)
363443007,DF-0046D,Malignant tumor of ovary (disorder)
363537007,T-28812,Structure of extrapulmonary lymph node of lung (body structure)
363563002,M-300F2,Entrapment (morphologic abnormality)
363589002,G-C2D0,Associated procedure (attribute)
363654007,T-D14AE,Structure of orbit proper (body structure)
363675004,R-40641,Intents (nature of procedure values) (qualifier value)
363676003,R-40642,Palliative - procedure intent (qualifier value)
363679005,P0-0099A,Imaging (procedure)
363698007,G-C0E3,Finding site (attribute)
363703001,G-C0E8,Has intent (attribute)
363704007,G-C0E9,Procedure site (attribute)
363713009,G-C0F2,Has interpretation (attribute)
363871006,F-04317,Mental state (observable entity)
364062005,F-043E6,Respiration observable (observable entity)
364091008,F-04403,Aortic root feature (observable entity)
364092001,F-04404,Coronary artery feature (observable entity)
364320009,F-0452A,Pregnancy observable (observable entity)
364393001,F-045CE,Nutritional observable (observable entity)
364528001,F-046D8,Skin observable (observable entity)
365416000,F-38035,Finding of electrocardiogram ST segment (finding)
365853002,F-01969,Imaging finding (finding)
365981007,F-93109,Finding of tobacco smoking behavior (finding)
366188009,F-30117,Finding of left ventricular function (finding)
367336001,P0-0058E,Chemotherapy (procedure)
367450005,R-4235F,Short (qualifier value)
367567000,T-D03B4,Structure of umbilical vein (body structure)
367577003,T-02106,Skin structure of eyebrow (body structure)
367578008,T-02488,Skin structure of hypogastric region (body structure)
367624001,T-F680F,Structure of ductus venosus (body structure)
367643001,M-3340A,Cyst (morphologic abnormality)
368479001,T-49217,Structure of superficial palmar venous arch (body structure)
368481004,T-49218,Structure of deep palmar venous arch (body structure)
368536000,T-18774,Structure of axillary fascia (body structure)
368550005,T-C4752,Structure of paramammary lymph node (body structure)
369790002,G-F616,Nottingham Combined Grade I: 3-5 points (finding)
369791003,G-F617,Nottingham Combined Grade II: 6-7 points (finding)
369792005,G-F618,Nottingham Combined Grade III: 8-9 points (finding)
369991007,G-F749,N3: Metastasis to ipsilateral internal mammary lymph node(s) (finding)
370129005,G-C036,Measurement method (attribute)
370359005,F-38095,Electrocardiogram equivocal (finding)
370367002,F-201B6,Exercise tolerance test equivocal (finding)
370388006,F-00D5F,Patient immunocompromised (finding)
370512004,DD-661D2,Migration of implant or internal device (disorder)
370951003,F-02087,Piggyback intraocular lens (finding)
371013005,T-C430A,Cardiophrenic angle lymph node (body structure)
371036001,D7-76202,Postsurgical menopause (disorder)
371195002,T-D0821,Bone structure of upper limb (body structure)
371240000,G-A11A,Red color (qualifier value)
371244009,G-A11D,Yellow color (qualifier value)
371246006,G-A11E,Green color (qualifier value)
371251000,G-A12B,White color (qualifier value)
371252007,G-A12C,Black color (qualifier value)
371253002,G-A12D,Gray color (qualifier value)
371254008,G-A12E,Brown color (qualifier value)
371304004,T-0262C,Skin structure of lower limb (body structure)
371311000,T-02008,Skin structure of upper limb (body structure)
371398005,T-D0801,Eye region structure (body structure)
371422002,G-0338,History of substance abuse (situation)
371439000,R-00254,Specimen type (observable entity)
371469007,R-00258,Histologic grade (observable entity)
371524004,R-42B89,Clinical report (record artifact)
371564000,L-877FB,Genus Rattus (organism)
371565004,L-877FC,Rattus norvegicus (organism)
371572003,P0-006F1,Nuclear medicine procedure (procedure)
371785003,R-002CC,Ambu bag (physical object)
371786002,R-00359,Pressure support ventilator (physical object)
371787006,R-0038C,Volume support ventilator (physical object)
371788001,R-00310,Intracoronary Doppler guide wire (physical object)
371789009,R-00311,Intracoronary pressure guide wire (physical object)
371790000,R-00303,External counter-pulsation circulatory support device (physical object)
371791001,R-00361,Radiofrequency ablation device (physical object)
371794009,R-002F0,Cutting balloon angioplasty device (physical object)
371795005,R-00312,Intravascular ultrasound device (physical object)
371796006,R-002FD,Directional coronary atherectomy device (physical object)
371797002,R-0036F,Saline thrombectomy device (physical object)
371798007,R-00306,Fluid filled catheter (physical object)
371799004,R-0030A,Hall catheter (physical object)
371800000,R-00379,Thermistor catheter (physical object)
371801001,R-00304,Fiberoptic catheter (physical object)
371802008,R-00383,Tip manometer (physical object)
371803003,R-00334,Multi vessel coronary artery disease (disorder)
371804009,R-00313,Left main coronary artery disease (disorder)
371805005,R-00372,Significant coronary bypass graft disease (disorder)
371807002,R-0038F,Atypical angina (disorder)
371808007,R-00368,Recurrent angina status post percutaneous transluminal coronary angioplasty (disorder)
371809004,R-00366,Recurrent angina status post coronary stent placement (disorder)
371810009,R-00365,Recurrent angina status post coronary artery bypass graft (disorder)
371811008,R-00369,Recurrent angina status post rotational atherectomy (disorder)
371812001,R-00367,Recurrent angina status post directional coronary atherectomy (disorder)
371813006,R-002C8,Acute mitral regurgitation from chordal rupture (disorder)
371814000,R-002C7,Acute mitral regurgitation from chordal dysfunction (disorder)
371815004,R-002C9,Acute mitral regurgitation from papillary muscle dysfunction (disorder)
371816003,R-002CA,Acute mitral regurgitation from papillary muscle rupture (disorder)
371817007,R-002CB,Acute ventricular septal rupture (disorder)
371824008,R-00336,Myocardial ischemia manifest on stress test status post myocardial infarction (finding)
371829003,R-00360,Pulmonary vein wedge pressure (observable entity)
371835003,R-00308,Fractional flow reserve using intracoronary bolus (observable entity)
371837006,R-0032D,Mitral valve flow (observable entity)
371838001,R-002E5,Cardiac output measurement by thermal bath method (procedure)
371839009,R-00394,"Derived flow, non-valve (observable entity)"
371840006,R-00385,Tricuspid valve flow (observable entity)
371841005,R-00309,Fractional flow reserve using intravenous infusion (observable entity)
371842003,R-00307,Fractional flow reserve (observable entity)
371843008,R-002E7,Cardiac output measurement by thermal inline method (procedure)
371845001,R-002D3,Aortic valve flow (observable entity)
371846000,R-0035D,Pulmonary valve flow (observable entity)
371847009,R-003A9,Tricuspid diastolic filling period (observable entity)
371848004,R-0035C,Pulmonary systolic ejection period (observable entity)
371849007,R-0032C,Mitral diastolic filling period (observable entity)
371850007,R-002D2,Aortic systolic ejection period (observable entity)
371851006,R-002D0,Angioplasty inflation pressure (observable entity)
371852004,R-002CF,Angioplasty inflation duration (observable entity)
371853009,R-002F5,"Derived period, non-valve (observable entity)"
371854003,R-0036C,Rotational atherectomy speed (observable entity)
371855002,R-00398,Hyperkinetic ventricular wall (finding)
371856001,R-0033F,Normal left heart hemodynamics (finding)
371857005,R-00340,Normal left ventricular systolic function and wall motion (finding)
371858000,R-0033E,Normal left and right heart hemodynamics (finding)
371859008,R-00342,Normal right heart hemodynamics (finding)
371860003,R-0033D,Normal coronary arteries (finding)
371861004,R-00328,Mild intimal coronary irregularities without significant stenoses (finding)
371862006,R-002F3,Depression of left ventricular systolic function (finding)
371863001,R-0039F,Perfusion finding (finding)
371864007,R-00381,Thrombolysis in Myocardial Infarction grade 2: partial perfusion (finding)
371865008,R-00382,Thrombolysis in Myocardial Infarction grade 3: complete perfusion (finding)
371866009,R-0037F,Thrombolysis in Myocardial Infarction grade 1: penetration without perfusion (finding)
371867000,R-0037E,Thrombolysis in Myocardial Infarction grade 0: no perfusion (finding)
371868005,R-00327,Mild hypokinesis of cardiac wall (finding)
371869002,R-0032F,Moderate hypokinesis of cardiac wall (finding)
371870001,R-00370,Severe hypokinesis of cardiac wall (finding)
371871002,R-00373,Single beats - numeric estimation technique (qualifier value)
371872009,R-003A1,Post stenotic dilation (finding)
371873004,R-00314,Luminal irregularities of coronary artery (finding)
371874005,R-002E3,Cardiac catheterization gradient assessment phase (qualifier value)
371875006,R-002FB,Device withdrawn and / or removed (finding)
371876007,R-002F7,Device at site of interest (finding)
371877003,R-002F8,Device inserted into sheath (finding)
371879000,R-002C4,Abnormally high (qualifier value)
371880002,R-002C5,Abnormally low (qualifier value)
371883000,R-00348,Outpatient procedure (procedure)
371884006,R-00363,Range of measurement uncertainty (qualifier value)
371885007,R-00362,Range of lower measurement uncertainty (qualifier value)
371886008,R-00364,Range of upper measurement uncertainty (qualifier value)
371887004,R-00338,Ninetieth percentile (qualifier value)
371888009,R-00397,Fifth percentile (qualifier value)
371889001,R-00337,Ninety-fifth percentile (qualifier value)
371890005,R-00377,Tenth percentile (qualifier value)
371892002,R-002F2,Delivered radiation dose (observable entity)
371893007,R-0036B,Restenotic lesion of coronary artery (finding)
371894001,R-002E2,Bifurcation lesion of coronary artery (disorder)
371895000,R-002EF,Culprit lesion of coronary artery (finding)
371896004,R-0037C,Thrombolytic agent administered less than 3 hours before percutaneous coronary intervention (situation)
371897008,R-0037A,Thrombolytic agent administered between 3 and 6 hours before percutaneous coronary intervention (situation)
371898003,R-0031B,Medication administered before lab visit (situation)
371899006,R-0031A,Medication administered after lab visit (situation)
371900001,R-00320,Medication not administered (situation)
371901002,R-0031E,Medication administered less than 72 hours before percutaneous coronary intervention (situation)
371902009,R-00399,Medication administered after percutaneous coronary intervention (situation)
371903004,R-0039A,Medication administered during percutaneous coronary intervention (situation)
371904005,R-0031F,Medication administered prior to percutaneous coronary intervention (situation)
371905006,R-0031C,Medication administered during lab visit (situation)
371906007,R-0037B,Thrombolytic agent administered between 6 hours and 7 days before percutaneous coronary intervention (situation)
371907003,R-0034A,Oxygen administration by nasal cannula (procedure)
371908008,R-00349,Oxygen administration by mask (procedure)
371909000,R-00315,Magnet induced pacing (procedure)
371910005,R-002D9,Atrioventricular sequential pacing (procedure)
371911009,R-00318,Measurement of blood pressure using cuff method (procedure)
371912002,R-002E1,Best value - numeric estimation technique (qualifier value)
371913007,R-00355,Point source - numeric estimation technique (qualifier value)
371914001,R-00353,Peak to peak - numeric estimation technique (qualifier value)
371915000,R-002FC,Diffuse disease of coronary artery (finding)
371916004,R-0036A,Representative - numeric estimation technique (qualifier value)
371917008,R-00346,One standard deviation above mean (qualifier value)
371918003,R-00388,Two standard deviations below mean (qualifier value)
371919006,R-00347,One standard deviation below mean (qualifier value)
371920000,R-00387,Two standard deviations above mean (qualifier value)
371922008,R-00335,Multiple irregularities (qualifier value)
371923003,R-00329,Mild to moderate (qualifier value)
371924009,R-00330,Moderate to severe (qualifier value)
371925005,R-00333,Most significant (qualifier value)
371926006,R-0030C,Highly significant (qualifier value)
371928007,R-00345,Not significant (qualifier value)
371931008,R-002E9,Combined diagnostic and therapeutic (procedure)
371933006,R-0038B,Upper limit of reference range (qualifier value)
371934000,R-0039B,Normality undetermined (qualifier value)
371951007,R-003AA,Vena anonyma (body structure)
371952000,R-00376,Systemic arterial blood (substance)
371953005,R-0035B,Pulmonary artery blood (substance)
371954004,R-0035E,Pulmonary vein blood (substance)
372073000,T-A010F,Cerebral hemisphere structure (body structure)
372074006,T-14122,Skeletal muscle structure of chest wall (body structure)
372242005,T-AA092,Vitreous body part (body structure)
372249001,R-00274,Tumor margin status (observable entity)
372276001,R-00288,Nottingham Combined Grade (observable entity)
372460008,G-D173,Intracardiac route (qualifier value)
372463005,G-D17C,Intracoronary route (qualifier value)
372464004,G-D17D,Intradermal route (qualifier value)
372480009,C-00211,"Macrolide (class of antibiotic, substance) (substance)"
372578001,F-616E7,Plasma expander (substance)
372580007,F-616EB,Bronchodilator (substance)
372602008,F-616FE,Metronidazole (substance)
372614000,F-6171D,Sedative (substance)
372656001,F-6188F,Opiate antagonist (substance)
372664007,R-F2B1D,Benzodiazepine (substance)
372665008,F-61898,Non-steroidal anti-inflammatory agent (substance)
