132026004,L-80558,Euroline pig breed (organism)
132027008,L-80559,Norline pig breed (organism)
132028003,L-8055A,Premier pig breed (organism)
132029006,L-8055B,Tribred pig breed (organism)
132030001,L-8055C,American Essex pig breed (organism)
132031002,L-8055D,Sino-Gascony pig breed (organism)
132032009,L-8055E,Guadeloupe Crole pig breed (organism)
132033004,L-8055F,Managra pig breed (organism)
132034005,L-8056A,Canadian Landrace pig breed (organism)
132035006,L-8056B,Canadian Yorkshire pig breed (organism)
132037003,L-8056D,Pineywoods pig breed (organism)
132038008,L-8056E,Catalina Island pig breed (organism)
132039000,L-8056F,Ras-n-Lansa pig breed (organism)
132040003,L-8057B,Pitman-Moore Miniature pig breed (organism)
132041004,L-8057C,Vita Vet Lab Minipig pig breed (organism)
132042006,L-8057D,Hanford Miniature pig breed (organism)
132043001,L-8057E,Black Hampshire pig breed (organism)
132044007,L-8057F,Red Hamprace pig breed (organism)
132045008,L-80583,American Yorkshire pig breed (organism)
132046009,L-80584,American Berkshire pig breed (organism)
132047000,L-80585,Camborough Blue pig breed (organism)
132048005,L-80586,Camborough 12 pig breed (organism)
132049002,L-80587,Westrain pig breed (organism)
132050002,L-80588,Dalland 030 pig breed (organism)
132051003,L-80589,Razor-Back pig breed (organism)
132052005,L-8058A,Macau pig breed (organism)
132053000,L-8058B,Moura pig breed (organism)
132054006,L-8058C,Canastra pig breed (organism)
132055007,L-8058D,Pirapetinga pig breed (organism)
132056008,L-8058E,Piau pig breed (organism)
132057004,L-8058F,Nilo-Canastra pig breed (organism)
132058009,L-80595,Canastro pig breed (organism)
132059001,L-80596,"Canastro, Junqueira pig breed (organism)"
132060006,L-80597,"Canastro, Capito Chico pig breed (organism)"
132061005,L-80598,"Canastro, Zabumba pig breed (organism)"
132062003,L-80599,"Canastro, Cabano pig breed (organism)"
132063008,L-8059A,"Canastro, Vermelho pig breed (organism)"
132064002,L-8059B,"Piau, Caruncho Piau pig breed (organism)"
132065001,L-8059C,Canastrinho pig breed (organism)
132066000,L-8059D,Honduras Switch-Tail pig breed (organism)
132067009,L-8059E,Mastergilt pig breed (organism)
132068004,L-8059F,Sovereign pig breed (organism)
132069007,L-805A1,Poltava pig breed (organism)
132070008,L-805A2,Lipetsk pig breed (organism)
132071007,L-805A3,Soviet Meat pig breed (organism)
132072000,L-805A4,Central Russian pig breed (organism)
132073005,L-805A5,Steppe Meat pig breed (organism)
132074004,L-805A6,Kharkov pig breed (organism)
132075003,L-805A7,Dnepropetrovsk pig breed (organism)
132076002,L-805A8,Russian Large White pig breed (organism)
132077006,L-805A9,Forest Mountain pig breed (organism)
132078001,L-805AA,Dnieper pig breed (organism)
132079009,L-805AB,Iberian pig breed (organism)
132080007,L-805AC,"Iberian, Extremadura Red pig breed (organism)"
132081006,L-805AD,"Iberian, Jabugo Spotted pig breed (organism)"
132082004,L-805AE,"Iberian, Black Iberian pig breed (organism)"
132083009,L-805AF,"Philippine Native, Ilocos pig breed (organism)"
132084003,L-805B1,"Philippine Native, Jalajala pig breed (organism)"
132085002,L-805B2,Mangalizta pig breed (organism)
132086001,L-805B3,Alentejana pig breed (organism)
132087005,L-805B4,"Belgian Landrace, BN pig breed (organism)"
132088000,L-805B5,French Large White pig breed (organism)
132089008,L-805B6,Hyper Large White pig breed (organism)
132090004,L-805B7,Tia Meslan pig breed (organism)
132091000,L-805B8,Pen ar Lan 77 pig breed (organism)
132092007,L-805B9,Penshire pig breed (organism)
132093002,L-805BA,Laconie pig breed (organism)
132094008,L-805BB,Murcian pig breed (organism)
132095009,L-805BC,Cavallino pig breed (organism)
132096005,L-805BD,Calabrian pig breed (organism)
132097001,L-805BE,Apulian pig breed (organism)
132098006,L-805BF,Siena Belted pig breed (organism)
132099003,L-805C1,Calascibetta pig breed (organism)
132100006,L-805C2,Gssing Forest Pig pig breed (organism)
132101005,L-805C3,Swiss Edelschwein pig breed (organism)
132102003,L-805C4,North Caucasus pig breed (organism)
132103008,L-805C5,Don pig breed (organism)
132104002,L-805C6,Rostov pig breed (organism)
132105001,L-805C7,Russian Long-Eared White pig breed (organism)
132106000,L-805C8,Russian Short-Eared White pig breed (organism)
132107009,L-805C9,Prisheksninsk pig breed (organism)
132108004,L-805CA,Breitov pig breed (organism)
132109007,L-805CB,Livny pig breed (organism)
132110002,L-805CC,Tsivilsk pig breed (organism)
132111003,L-805CD,Urzhum pig breed (organism)
132112005,L-805CE,Minisib pig breed (organism)
132113000,L-805CF,Sakhalin White pig breed (organism)
132114006,L-805D0,North Siberian pig breed (organism)
132115007,L-805D1,Siberian Black Pied pig breed (organism)
132116008,L-805D2,Kemerovo pig breed (organism)
132117004,L-805D3,KM-1 pig breed (organism)
132118009,L-805D4,Aksa Black Pied pig breed (organism)
132119001,L-805D5,Semirechensk pig breed (organism)
132120007,L-805D6,Min pig breed (organism)
132121006,L-805D7,Sanjiang White pig breed (organism)
132122004,L-805D8,Basque Black Pied pig breed (organism)
132123009,L-805D9,Corsican pig breed (organism)
132124003,L-805DA,Crole pig breed (organism)
132125002,L-805DB,Gascony pig breed (organism)
132126001,L-805DC,Limousin pig breed (organism)
132127005,L-805DD,Harbin White pig breed (organism)
132128000,L-805DE,Heilongjiang Spotted pig breed (organism)
132129008,L-805DF,Liaoning Black pig breed (organism)
132130003,L-805E1,"Huang-Huai-Hai Black, Shenxian pig breed (organism)"
132131004,L-805E2,Huang-Huai-Hai Black pig breed (organism)
132132006,L-805E3,Bamei pig breed (organism)
132133001,L-805E4,Hanjiang Black pig breed (organism)
132134007,L-805E5,Ding pig breed (organism)
132135008,L-805E6,Huai pig breed (organism)
132136009,L-805E7,New Huai pig breed (organism)
132137000,L-805E8,Mashen pig breed (organism)
132138005,L-805E9,Yimeng Black pig breed (organism)
132139002,L-805EB,Hetao Lop-Ear pig breed (organism)
132140000,L-805EC,Korean Native pig breed (organism)
132141001,L-805ED,Korean Improved pig breed (organism)
132142008,L-805EE,Penbuk pig breed (organism)
132143003,L-805EF,Beijing Black pig breed (organism)
132144009,L-805F1,Chenghua pig breed (organism)
132145005,L-805F2,Taoyuan pig breed (organism)
132146006,L-805F3,Taiwan Small Black pig breed (organism)
132147002,L-805F4,Taiwan Small Red pig breed (organism)
132148007,L-805F5,Guanling pig breed (organism)
132149004,L-805F6,Huchuan Mountain pig breed (organism)
132150004,L-805F7,Rongchang pig breed (organism)
132151000,L-805F8,Wujin pig breed (organism)
132152007,L-805F9,Dahe pig breed (organism)
132153002,L-805FA,Yanan pig breed (organism)
132154008,L-805FB,South Yunnan Short-Eared pig breed (organism)
132155009,L-805FC,"Hainan, Lingao pig breed (organism)"
132156005,L-805FD,"Hainan, Tunchang pig breed (organism)"
132157001,L-805FE,"Hainan, Wenchang pig breed (organism)"
132158006,L-805FF,Liang Guang Small Spotted pig breed (organism)
132159003,L-8060A,German Pasture pig breed (organism)
132160008,L-8060B,"Piau, Sorocaba pig breed (organism)"
132161007,L-8060C,Nilo pig breed (organism)
132162000,L-8060D,Bahia pig breed (organism)
132163005,L-8060E,Perna-Curta pig breed (organism)
132164004,L-8060F,Carunchinho pig breed (organism)
132165003,L-80613,Mandi pig breed (organism)
132166002,L-80614,Orehla de Colher pig breed (organism)
132167006,L-80615,Venezuelan Black pig breed (organism)
132168001,L-80616,Bolivian pig breed (organism)
132169009,L-80617,Peln pig breed (organism)
132170005,L-80618,Mexican Wattled pig breed (organism)
132171009,L-80619,Dalland 080 pig breed (organism)
132173007,L-8061B,Monarch pig breed (organism)
132174001,L-8061C,Bisaro pig breed (organism)
132175000,L-8061D,Black Hairless pig breed (organism)
132176004,L-8061E,Black Mangalitsa pig breed (organism)
132178003,L-80623,Borghigiana pig breed (organism)
132179006,L-80624,Chianina pig breed (organism)
132180009,L-80625,Cosentina pig breed (organism)
132181008,L-80626,Cuino pig breed (organism)
132182001,L-80627,Friuli Black pig breed (organism)
132183006,L-80628,Fumati pig breed (organism)
132184000,L-80629,Galician pig breed (organism)
132185004,L-8062A,German Berkshire pig breed (organism)
132186003,L-8062B,Ghori pig breed (organism)
132187007,L-8062C,Jianli pig breed (organism)
132188002,L-8062D,Lucanian pig breed (organism)
132189005,L-8062E,Maremmana pig breed (organism)
132190001,L-8062F,Miami pig breed (organism)
132191002,L-80634,Montmorillon pig breed (organism)
132192009,L-80635,Old Swedish Spotted pig breed (organism)
132193004,L-80636,Oliventina pig breed (organism)
132194005,L-80637,Parmense pig breed (organism)
132195006,L-80638,Romagnola pig breed (organism)
132196007,L-80639,Siberian pig breed (organism)
132197003,L-8063A,Small White pig breed (organism)
132198008,L-8063B,Baltaret pig breed (organism)
132199000,L-8063C,Tunchang pig breed (organism)
132200002,L-8063D,Sterling pig breed (organism)
132201003,L-8063E,Vich pig breed (organism)
132202005,L-8063F,Vietnamese pig breed (organism)
132203000,L-80645,Vitoria pig breed (organism)
132204006,L-80646,Wai Chow pig breed (organism)
132205007,L-80647,Yorkshire Blue and White pig breed (organism)
132206008,L-80648,Dalland 020 pig breed (organism)
132207004,L-80649,Wiltshire pig breed (organism)
132208009,L-8064A,Hamroc pig breed (organism)
132209001,L-8064B,DRU (TM) Terminals pig breed (organism)
132210006,L-8064C,Camborough 22 pig breed (organism)
132211005,L-8064D,Camborough 15 pig breed (organism)
132212003,L-8064E,PR 1050 pig breed (organism)
132213008,L-8064F,PR 1075 pig breed (organism)
132214002,L-8065A,Chryak PIC pig breed (organism)
132215001,L-8065B,Canadian Royal Blue pig breed (organism)
132216000,L-8065C,Line 500 Duroc pig breed (organism)
132217009,L-8065D,Bodmin 950 pig breed (organism)
132218004,L-8065E,Canadian Duroc pig breed (organism)
132219007,L-8065F,Canadian Hampshire pig breed (organism)
132220001,L-80664,Ba Xuyen pig breed (organism)
132221002,L-80665,Arapawa Island pig breed (organism)
132222009,L-80666,Wuzhishan pig breed (organism)
132223004,L-80667,Philippine Native pig breed (organism)
132224005,L-80668,Sinclair Miniature pig breed (organism)
132225006,L-80669,Saddleback pig breed (organism)
132226007,L-8066A,Yucatan Miniature pig breed (organism)
132227003,L-8066B,Bantu pig breed (organism)
132228008,L-8066C,Tibetan pig breed (organism)
132229000,L-8066D,Turopolje pig breed (organism)
132230005,L-8066E,Vietnamese Pot-Bellied Pig pig breed (organism)
132231009,L-8066F,American Landrace pig breed (organism)
132232002,L-80670,Swallow Belied Mangalitza pig breed (organism)
132233007,L-80671,Fengjing pig breed (organism)
132234001,L-80672,Finnish Landrace pig breed (organism)
132235000,L-80673,Guinea Hog pig breed (organism)
132236004,L-80674,Hezuo pig breed (organism)
132237008,L-80675,Ossabaw Island pig breed (organism)
132238003,L-80676,Kele pig breed (organism)
132239006,L-80677,Krskopolje pig breed (organism)
132240008,L-80678,Kunekune pig breed (organism)
132241007,L-80679,Large Black-White pig breed (organism)
132242000,L-8067A,Lithuanian Native pig breed (organism)
132243005,L-8067B,Meishan pig breed (organism)
132244004,L-8067C,Jinhua pig breed (organism)
132245003,L-8067D,Ningxiang pig breed (organism)
132246002,L-8067E,Mora Romagnola pig breed (organism)
132247006,L-8067F,Mukota pig breed (organism)
132248001,L-80680,Minzhu pig breed (organism)
132249009,L-80681,Neijiang pig breed (organism)
132250009,L-80682,Mulefoot pig breed (organism)
132251008,L-80683,Normand pig breed (organism)
132252001,L-80684,Angeln Saddleback pig breed (organism)
132253006,L-80685,Greek Local pig breed (organism)
132254000,L-80686,Icelandic pig breed (organism)
132255004,L-80687,Casertana pig breed (organism)
132256003,L-80688,Madonie-Sicilian pig breed (organism)
132257007,L-80689,Sardinian pig breed (organism)
132258002,L-8068A,Sicilian pig breed (organism)
132259005,L-8068B,Zlotniki Spotted pig breed (organism)
132260000,L-8068C,Zlotniki White pig breed (organism)
132261001,L-8068D,Siska pig breed (organism)
132262008,L-8068E,Sumadija pig breed (organism)
132263003,L-8068F,Froxfield Pygmy pig breed (organism)
132264009,L-80690,Danish Large White pig breed (organism)
132265005,L-80691,Danish Duroc pig breed (organism)
132266006,L-80692,Danish Hampshire pig breed (organism)
132267002,L-80693,Piggham pig breed (organism)
132268007,L-80694,New York Red pig breed (organism)
132269004,L-80695,Finnish Yorkshire pig breed (organism)
132270003,L-80696,Dutch Yorkshire pig breed (organism)
132271004,L-80697,Pulawy pig breed (organism)
132272006,L-80698,Pomeranian pig breed (organism)
132273001,L-80699,Polish Landrace pig breed (organism)
132274007,L-8069A,Estonian Bacon pig breed (organism)
132275008,L-8069B,Latvian White pig breed (organism)
132276009,L-8069C,Lithuanian White pig breed (organism)
132277000,L-8069D,BKB-1 pig breed (organism)
132278005,L-8069E,Belorus Black Pied pig breed (organism)
132279002,L-8069F,Mirgorod pig breed (organism)
132280004,L-806A1,"Liang Guang Small Spotted, Luchuan pig breed (organism)"
132281000,L-806A2,Fujian Small pig breed (organism)
132282007,L-806A3,North Fujian Black-and-White pig breed (organism)
132283002,L-806A4,Fuan Spotted pig breed (organism)
132284008,L-806A5,Putian pig breed (organism)
132285009,L-806A6,Fuzhou Black pig breed (organism)
132286005,L-806A7,Minbei Spotted pig breed (organism)
132287001,L-806A8,Lantang pig breed (organism)
132288006,L-806A9,"Liang Guang Small Spotted, Guangdong Small Ear pig breed (organism)"
132289003,L-806AA,Longlin pig breed (organism)
132290007,L-806AB,Yuedong Black pig breed (organism)
132291006,L-806AC,Xiang pig breed (organism)
132292004,L-806AD,Cantonese pig breed (organism)
132293009,L-806AE,"Jinhua, Dongyang pig breed (organism)"
132294003,L-806AF,"Jinhua, Yongkang pig breed (organism)"
132295002,L-806B1,Daweizi pig breed (organism)
132296001,L-806B2,Huazhong Two-End Black pig breed (organism)
132297005,L-806B3,"Huazhong Two-End Black, Jianli pig breed (organism)"
132298000,L-806B4,"Huazhong Two-End Black, Tongcheng pig breed (organism)"
132299008,L-806B5,"Huazhong Two-End Black, Satzeling pig breed (organism)"
132300000,L-806B6,Ganzhongnan Spotted pig breed (organism)
132301001,L-806B7,Hang pig breed (organism)
132302008,L-806B8,Leping pig breed (organism)
132303003,L-806B9,Longyou Black pig breed (organism)
132304009,L-806BA,Wuyi Black pig breed (organism)
132305005,L-806BB,Lee-Sung pig breed (organism)
132306006,L-806BC,Lan-Yu pig breed (organism)
132307002,L-806BD,Vietnamese Yorkshire pig breed (organism)
132308007,L-806BE,Yujiang pig breed (organism)
132309004,L-806BF,Wanzhe Spotted pig breed (organism)
132310009,L-806C1,"Wanzhe Spotted, Chunan Spotted pig breed (organism)"
132311008,L-806C2,"Wanzhe Spotted, Wannan Spotted pig breed (organism)"
132312001,L-806C3,Shengxian Spotted pig breed (organism)
132313006,L-806C4,Qingping pig breed (organism)
132314000,L-806C5,Xiangxi Black pig breed (organism)
132315004,L-806C6,Bamaxiang pig breed (organism)
132316003,L-806C7,Taihu pig breed (organism)
132317007,L-806C8,Erhulian pig breed (organism)
132318002,L-806C9,Jiaxing Black pig breed (organism)
132319005,L-806CA,Mi pig breed (organism)
132320004,L-806CB,Shahutou pig breed (organism)
132321000,L-806CC,Jiaoxi pig breed (organism)
132322007,L-806CD,Shanghai White pig breed (organism)
132323002,L-806CE,Hubei White pig breed (organism)
132324008,L-806CF,Xinjin pig breed (organism)
132325009,L-806D1,"Xinjin, Jilin Black pig breed (organism)"
132326005,L-806D2,"Xinjin, Ning-an pig breed (organism)"
132327001,L-806D3, pig breed (organism)
132328006,L-806D4,DBI pig breed (organism)
132329003,L-806D5,"Xinjin, Xinjin pig breed (organism)"
132330008,L-806D6,Meixin pig breed (organism)
132331007,L-806D7,North East China Spotted pig breed (organism)
132332000,L-806D8,Fannong Spotted pig breed (organism)
132333005,L-806D9,Laoshan pig breed (organism)
132334004,L-806DA,Nanjing Black pig breed (organism)
132335003,L-806DB,Shanxi Black pig breed (organism)
132336002,L-806DC,Ganzhou White pig breed (organism)
132337006,L-806DD,Guangxi White pig breed (organism)
132338001,L-806DE,Hanzhong White pig breed (organism)
132339009,L-806DF,Lutai White pig breed (organism)
132340006,L-806E1,Yili White pig breed (organism)
132341005,L-806E2,Xinjiang White pig breed (organism)
132342003,L-806E3,BSI pig breed (organism)
132343008,L-806E4,Mong Cai pig breed (organism)
132344002,L-806E5,Lang Hong pig breed (organism)
132345001,L-806E6,Muong Khuong pig breed (organism)
132346000,L-806E7,Meo pig breed (organism)
132347009,L-806E8,Tong Con pig breed (organism)
132348004,L-806E9,Ha Bac pig breed (organism)
132349007,L-806EA,Thai Binh pig breed (organism)
132350007,L-806EB,Co pig breed (organism)
132351006,L-806EC,Swiss Improved Landrace pig breed (organism)
132352004,L-806ED,German Landrace B pig breed (organism)
132353009,L-806EE,Edelschwein pig breed (organism)
132354003,L-806EF,Swabian-Hall pig breed (organism)
132355002,L-806F1,Bentheim Black Pied pig breed (organism)
132356001,L-806F2,Baldinger Spotted pig breed (organism)
132357005,L-806F3,German Red Pied pig breed (organism)
132358000,L-806F4,German Cornwall pig breed (organism)
132359008,L-806F5,Gttingen Miniature pig breed (organism)
132360003,L-806F6,Munich Miniature pig breed (organism)
132361004,L-806F8,Leicoma pig breed (organism)
132362006,L-806F9,Schwerfurt Meat pig breed (organism)
132363001,L-806FA,Hungarian White pig breed (organism)
132364007,L-806FB,Hungahyb pig breed (organism)
132365008,L-806FC,Bulgarian Native pig breed (organism)
132366009,L-806FD,East Balkan pig breed (organism)
132367000,L-806FE,Kula pig breed (organism)
132368005,L-806FF,Nghia Binh pig breed (organism)
132369002,L-8077A,"Dachshund, Miniature breed (organism)"
132371002,L-807E2,Bichon Teneriffe dog breed (organism)
132372009,L-807E3,Bizanian Hound dog breed (organism)
132373004,L-807E4,Saint Hubert bloodhound dog breed (organism)
132374005,L-807E5,"Bloodhound, Southern Hound dog breed (organism)"
132376007,L-807E7,Brandlbracke dog breed (organism)
132377003,L-807E8,Braque d'Arige dog breed (organism)
132378008,L-807E9,Portuguese Guard Dog breed (organism)
132379000,L-807EA,Great Mnsterlnder dog breed (organism)
132380002,L-807EB,"Beagle, Smooth dog breed (organism)"
132381003,L-807EC,"Beagle, Rough dog breed (organism)"
132382005,L-807ED,"Belgian Griffon, Rough dog breed (organism)"
132383000,L-807EE,"Belgian Griffon, Smooth dog breed (organism)"
132384006,L-807EF,Braque Belge dog breed (organism)
132385007,L-807F1,Belgian Street Dog breed (organism)
132386008,L-807F2,Bernese Hound dog breed (organism)
132387004,L-808A1,Eurasier dog breed (organism)
132388009,L-808A2,English Bulldog breed (organism)
132389001,L-808A3,Dogue de Bordeaux dog breed (organism)
132390005,L-808A4,Kai Ken dog breed (organism)
132391009,L-808A5,Kui Mlk dog breed (organism)
132392002,L-808A6,Argentine Dogo dog breed (organism)
132393007,L-808A7,Alentejo herder dog breed (organism)
132394001,L-808A8,"Saint Bernard, Long-haired dog breed (organism)"
132395000,L-808A9,"Saint Bernard, Short-haired dog breed (organism)"
132396004,L-808AA,West Siberian Laika dog breed (organism)
132397008,L-808AB,Basset Fauve de Bretagne dog breed (organism)
132398003,L-808AC,Japanese Retriever dog breed (organism)
132399006,L-808AD,Kai Dog breed (organism)
132400004,L-808AE,American Blue Gascon Hound dog breed (organism)
132401000,L-808AF,Beagle Harrier dog breed (organism)
132402007,L-808B1,Kangal Dog breed (organism)
132403002,L-808B2,Leopard Cur dog breed (organism)
132404008,L-808B3,Patterdale Terrier dog breed (organism)
132405009,L-808B4,Petit Brabaon dog breed (organism)
132406005,L-808B5,Aidi dog breed (organism)
132407001,L-808B6,American Indian Dog breed (organism)
132408006,L-808B7,Austrian Pinscher dog breed (organism)
132409003,L-808B8,"American Eskimo, standard dog breed (organism)"
132410008,L-808B9,"American Eskimo, Miniature dog breed (organism)"
132411007,L-808BA,"American Eskimo, Toy dog breed (organism)"
132412000,L-808BB,Basset Griffon Venden dog breed (organism)
132413005,L-808BC,Batard dog breed (organism)
132414004,L-808BD,Basset Bleu de Gascogne dog breed (organism)
132415003,L-808BE,Braque Dupuy dog breed (organism)
132416002,L-808BF,Bruno de Jura dog breed (organism)
132417006,L-808C1,Co da Serra de Aires dog breed (organism)
132418001,L-808C2,Co de Castro Laboreiro dog breed (organism)
132419009,L-808C3,Co de Fila Miguel dog breed (organism)
132420003,L-808C4,Catalan Sheepdog breed (organism)
132421004,L-808C5,Caucasian Shepherd Dog breed (organism)
132422006,L-808C6,Cirneco dell'Etna dog breed (organism)
132423001,L-808C7,English Toy Terrier dog breed (organism)
132424007,L-808C8,German Spitz dog breed (organism)
132426009,L-808CA,Fauve de Bretagne dog breed (organism)
132427000,L-808CB,Hellenic Hound dog breed (organism)
132428005,L-808CC,Holland Shepherd dog breed (organism)
132429002,L-808CD,Japanese Spitz dog breed (organism)
132430007,L-808CE,Jmthund dog breed (organism)
132431006,L-808CF,Jindo dog breed (organism)
132432004,L-808D1,Karelo-Finnish Laika dog breed (organism)
132433009,L-808D2,King Shepherd dog breed (organism)
132434003,L-808D3,Kishu dog breed (organism)
132435002,L-808D4,Kirhiz dog breed (organism)
132436001,L-808D5,Magyar Agr dog breed (organism)
132437005,L-808D6,Middle Asian Ovtcharka dog breed (organism)
132438000,L-808D7,Mi-Ki dog breed (organism)
132439008,L-808D8,Miniature Australian Shepherd dog breed (organism)
132440005,L-808D9,Min-pei dog breed (organism)
132441009,L-808DA,Mountain Cur dog breed (organism)
132442002,L-808DB,Moscow Longhaired Toy Terrier dog breed (organism)
132443007,L-808DC,Perdigueiro Portuguese dog breed (organism)
132444001,L-808DD,Podengo Canario dog breed (organism)
132445000,L-808DE,Podengo Pequeno dog breed (organism)
132446004,L-808DF,Pressa Mallorquin dog breed (organism)
132447008,L-808E1,Pyrenean Mastiff dog breed (organism)
132448003,L-808E2,Rastreador Brasileiro dog breed (organism)
132449006,L-808E3,Sabueso Espaol dog breed (organism)
132450006,L-808E4,Schiller Hound dog breed (organism)
132451005,L-808E5,South Russian Steppe Hound dog breed (organism)
132452003,L-808E6,Styrian Mountain dog breed (organism)
132453008,L-808E7,Berger du Languedoc dog breed (organism)
132454002,L-808E8,Teddy Roosevelt Terrier dog breed (organism)
132455001,L-808E9,Transylvanian Hound dog breed (organism)
132456000,L-808EA,Trigg Hound dog breed (organism)
132457009,L-808EB,Tyrolean Hound dog breed (organism)
132458004,L-808EC,White Shepherd dog breed (organism)
132459007,L-808ED,Wirehair Styrian mountain dog breed (organism)
132460002,L-808EE,Yugoslavian Hound dog breed (organism)
132461003,L-808EF,Old Farm Collie dog breed (organism)
132462005,L-808F1,Old German Shepherd dog breed (organism)
132463000,L-808F2,New Zealand Heading Dog breed (organism)
132464006,L-808F3,German Koolie dog breed (organism)
132465007,L-808F4,Smithfield dog breed (organism)
132466008,L-808F5,Spanish Greyhound dog breed (organism)
132467004,L-808F6,Armant dog breed (organism)
132468009,L-808F8,Australian Greyhound dog breed (organism)
132469001,L-808F9,"Australian Terrier, rough-coated dog breed (organism)"
132470000,L-808FA,"Australian Terrier, silky dog breed (organism)"
132471001,L-808FB,Austrian Hound dog breed (organism)
132472008,L-808FC,Austrian Smooth-Haired Bracke dog breed (organism)
132473003,L-808FD,Balkan Hound dog breed (organism)
132474009,L-808FE,Banjara greyhound dog breed (organism)
132475005,L-808FF,"Beagle, Standard dog breed (organism)"
132476006,L-80916,Estrela Mountain Dog breed (organism)
132477002,L-80917,Epagneul Picard dog breed (organism)
132478007,L-80918,Epagneul Bleu de Picardie dog breed (organism)
132479004,L-80919,Estonian Hound dog breed (organism)
132480001,L-80920,Epagneul Pont-Audemer dog breed (organism)
132481002,L-80921,Eurasian dog breed (organism)
132482009,L-80922,Fell Terrier dog breed (organism)
132483004,L-80923,Fila Brasileiro dog breed (organism)
132484005,L-80924,Finnish Hound dog breed (organism)
132485006,L-80925,Finnish Lapphund dog breed (organism)
132486007,L-80926,Entlebucher dog breed (organism)
132487003,L-80927,French Guard Dog breed (organism)
132488008,L-80928,French Spaniel dog breed (organism)
132489000,L-80929,Coton de Tular dog breed (organism)
132490009,L-80930,Hamiltonstvare dog breed (organism)
132491008,L-80931,Danish Broholmer dog breed (organism)
132492001,L-80932,English Shepherd dog breed (organism)
132493006,L-80933,Drentse Patrijshond dog breed (organism)
132494000,L-80934,Dunker dog breed (organism)
132495004,L-80935,Kooikerhondje dog breed (organism)
132496003,L-80936,Dutch Shepherd dog breed (organism)
132497007,L-80937,East Siberian Laika dog breed (organism)
132498002,L-80938,Deutsche bracke dog breed (organism)
132499005,L-80939,Hanoverian Hound dog breed (organism)
132500001,L-80940,Hovawart dog breed (organism)
132501002,L-80941,Icelandic Sheepdog breed (organism)
132502009,L-80942,Inca Hairless Dog breed (organism)
132503004,L-80943,Irish Red and White Setter dog breed (organism)
132504005,L-80944,Jagdterrier dog breed (organism)
132505006,L-80945,German Spaniel dog breed (organism)
132506007,L-80946,Grand Anglo-Franais dog breed (organism)
132507003,L-80947,Grand Bassett Griffon Venden dog breed (organism)
132508008,L-80948,Grand Bleu de Gascogne dog breed (organism)
132509000,L-80949,Grand Gascon-Saintongeois dog breed (organism)
132510005,L-80950,German Pinscher dog breed (organism)
132511009,L-80951,Greater Swiss Mountain Dog breed (organism)
132512002,L-80952,Greenland Dog breed (organism)
132513007,L-80953,Griffon Fauve de Bretegne dog breed (organism)
132514001,L-80954,Griffon Nivernais dog breed (organism)
132515000,L-80955,Grand Griffon Venden dog breed (organism)
132516004,L-80956,Ainu dog breed (organism)
132517008,L-80957,Basset Artsian Normand dog breed (organism)
